{
  "name": "Klondike Solitaire",
  "deck": "standard-deck.json",
  "players": {
    "min": 1,
    "max": 1
  },
  "globalPlaces": [
    {
      "name": "Stock",
      "location": { "x": 30, "y": 20 },
      "arrangement": { "spreadX": 0.1, "spreadY": 0.1 },
      "defaultFlip": "faceDown",
      "startingSet": "full",
      "arrivalLocation": "top",
      "shuffleOnArrival": true
    },
    {
      "name": "Waste",
      "location": { "x": 75, "y": 20 },
      "arrangement": { "spreadX": 0, "spreadY": 3 },
      "defaultFlip": "topFaceUp",
      "arrivalLocation": "top",
      "arrivalFlip": "faceUp"
    },
    {
      "name": "Foundation 1",
      "location": { "x": 150, "y": 20 },
      "arrangement": { "spreadX": 0.2, "spreadY": 0.2 },
      "defaultFlip": "faceUp",
      "arrivalLocation": "top",
      "arrivalFlip": "faceUp"
    },
    {
      "name": "Foundation 2",
      "location": { "x": 195, "y": 20 },
      "arrangement": { "spreadX": 0.2, "spreadY": 0.2 },
      "defaultFlip": "faceUp",
      "arrivalLocation": "top",
      "arrivalFlip": "faceUp"
    },
    {
      "name": "Foundation 3",
      "location": { "x": 240, "y": 20 },
      "arrangement": { "spreadX": 0.2, "spreadY": 0.2 },
      "defaultFlip": "faceUp",
      "arrivalLocation": "top",
      "arrivalFlip": "faceUp"
    },
    {
      "name": "Foundation 4",
      "location": { "x": 285, "y": 20 },
      "arrangement": { "spreadX": 0.2, "spreadY": 0.2 },
      "defaultFlip": "faceUp",
      "arrivalLocation": "top",
      "arrivalFlip": "faceUp"
    },
    {
      "name": "Tableau 1",
      "location": { "x": 30, "y": 90 },
      "arrangement": { "spreadX": 0, "spreadY": 15 },
      "defaultFlip": "topFaceUp",
      "arrivalLocation": "top",
      "arrivalFlip": "faceUp"
    },
    {
      "name": "Tableau 2",
      "location": { "x": 72, "y": 90 },
      "arrangement": { "spreadX": 0, "spreadY": 15 },
      "defaultFlip": "topFaceUp",
      "arrivalLocation": "top",
      "arrivalFlip": "faceUp"
    },
    {
      "name": "Tableau 3",
      "location": { "x": 114, "y": 90 },
      "arrangement": { "spreadX": 0, "spreadY": 15 },
      "defaultFlip": "topFaceUp",
      "arrivalLocation": "top",
      "arrivalFlip": "faceUp"
    },
    {
      "name": "Tableau 4",
      "location": { "x": 156, "y": 90 },
      "arrangement": { "spreadX": 0, "spreadY": 15 },
      "defaultFlip": "topFaceUp",
      "arrivalLocation": "top",
      "arrivalFlip": "faceUp"
    },
    {
      "name": "Tableau 5",
      "location": { "x": 198, "y": 90 },
      "arrangement": { "spreadX": 0, "spreadY": 15 },
      "defaultFlip": "topFaceUp",
      "arrivalLocation": "top",
      "arrivalFlip": "faceUp"
    },
    {
      "name": "Tableau 6",
      "location": { "x": 240, "y": 90 },
      "arrangement": { "spreadX": 0, "spreadY": 15 },
      "defaultFlip": "topFaceUp",
      "arrivalLocation": "top",
      "arrivalFlip": "faceUp"
    },
    {
      "name": "Tableau 7",
      "location": { "x": 282, "y": 90 },
      "arrangement": { "spreadX": 0, "spreadY": 15 },
      "defaultFlip": "topFaceUp",
      "arrivalLocation": "top",
      "arrivalFlip": "faceUp"
    }
  ]
}
