{
  "name": "Rummy",
  "deck": "standard-deck.json",
  "players": {
    "min": 2,
    "max": 4
  },
  "globalPlaces": [
    {
      "name": "Draw Pile",
      "location": { "x": 40, "y": 50 },
      "arrangement": { "spreadX": 0.1, "spreadY": 0.1 },
      "defaultFlip": "faceDown",
      "startingSet": "full",
      "arrivalLocation": "bottom",
      "shuffleOnArrival": true
    },
    {
      "name": "Discard Pile",
      "location": { "x": 60, "y": 50 },
      "arrangement": { "spreadX": 0, "spreadY": 3 },
      "defaultFlip": "topFaceUp",
      "arrivalLocation": "top",
      "arrivalFlip": "faceUp"
    }
  ],
  "playerPlaces": [
    {
      "name": "Hand",
      "location": { "x": 50, "y": 80 },
      "arrangement": { "spreadX": 12, "spreadY": 0 },
      "defaultFlip": "faceUp",
      "visibleToOtherPlayers": false
    },
    {
      "name": "Melds",
      "location": { "x": 50, "y": 40 },
      "arrangement": { "spreadX": 15, "spreadY": 0 },
      "defaultFlip": "faceUp",
      "visibleToOtherPlayers": true,
      "othersCanMoveIn": true,
      "othersCanMoveOut": false
    }
  ]
}
